Device, URL, RAM, CPU, Display Resolution, Instruction Set, OpenGL ES 2.0, Vector Floating Point
HTC One VX (HTC Totem C2), http://pdadb.net/index.php?m=specs&id=3904&view=1, 1024, 1200, 540x960, ARMv7,,
Asus Padfone 2 64GB, http://pdadb.net/index.php?m=specs&id=3938&view=1, 2048, 1512, 720x1280, ARMv7,,
Motorola Atrix TV XT682, http://pdadb.net/index.php?m=specs&id=3593&view=1, 512, 800, 480x854, ARMv7-A, Yes,
Acer Z110, http://pdadb.net/index.php?m=specs&id=3891&view=1, 256, 1000, 320x480, ARMv5TEJ,,
LG E973 Optimus G, http://pdadb.net/index.php?m=specs&id=3907&view=1, 2048, 1512, 768x1280, ARMv7,,
LG E960 Nexus 4 (LG Mako), http://pdadb.net/index.php?m=specs&id=3927&view=1, 2048, 1512, 768x1280, ARMv7,,
LG E970 Optimus G, http://pdadb.net/index.php?m=specs&id=3584&view=1, 2048, 1512, 768x1280, ARMv7,,
Samsung Galaxy Note II SC-02E, http://pdadb.net/index.php?m=specs&id=3920&view=1, 2048, 1600, 720x1280, ARMv7,,
Samsung GT-i9260 Galaxy Premier 16GB, http://pdadb.net/index.php?m=specs&id=3932&view=1, 1024, 1500, 720x1280, ARMv7-A,,
Amazon Kindle Fire 8.9 HD 32GB, http://pdadb.net/index.php?m=specs&id=3843&view=1, 1024, 1500, 1920x1200, ARMv7, Yes,
Amazon Kindle Fire 8.9 HD 4G LTE 64GB, http://pdadb.net/index.php?m=specs&id=3844&view=1, 1024, 1500, 1920x1200, ARMv7, Yes,
Samsung SCH-i415 Stratosphere II, http://pdadb.net/index.php?m=specs&id=3798&view=1, 1024, 1512, 480x800, ARMv7,,
Samsung GT-N7105 Galaxy Note II LTE 32GB, http://pdadb.net/index.php?m=specs&id=3807&view=1, 2048, 1600, 720x1280, ARMv7,,
HTC One X+ LTE (HTC Evitare), http://pdadb.net/index.php?m=specs&id=3903&view=1, 1024, 1700, 720x1280, ARMv7-A,,
Samsung SGH-i547 Galaxy Rugby Pro, http://pdadb.net/index.php?m=specs&id=3905&view=1, 768, 1500, 480x800, , ,
Samsung SPH-L900 Galaxy Note II LTE, http://pdadb.net/index.php?m=specs&id=3832&view=1, 2048, 1600, 720x1280, ARMv7,,
Samsung SCH-R950 Galaxy Note II LTE, http://pdadb.net/index.php?m=specs&id=3877&view=1, 2048, 1600, 720x1280, ARMv7,,
Samsung SCH-N719 Galaxy Note 2 CDMA, http://pdadb.net/index.php?m=specs&id=3916&view=1, 2048, 1600, 720x1280, ARMv7,,
Sony Xperia AX SOL21 (Sony Tsubasa), http://pdadb.net/index.php?m=specs&id=3918&view=1, 1024, 1512, 720x1280, ARMv7,,
LG LS860 Mach 4G LTE (LG Cayenne), http://pdadb.net/index.php?m=specs&id=3581&view=1, 1024, 1200, 480x800, ARMv7,,
Samsung SCH-i605 Galaxy Note II LTE, http://pdadb.net/index.php?m=specs&id=3833&view=1, 2048, 1600, 720x1280, ARMv7,,
Samsung GT-N7108 Galaxy Note II, http://pdadb.net/index.php?m=specs&id=3890&view=1, 2048, 1600, 720x1280, ARMv7,,
Verizon Samsung SCH-i915 Galaxy Tab 2 10.1 4G, http://pdadb.net/index.php?m=specs&id=3909&view=1, 1024, 1512, 1280x800, , ,
Sprint Samsung SPH-P500 Galaxy Tab 2 10.1 4G, http://pdadb.net/index.php?m=specs&id=3910&view=1, 1024, 1512, 1280x800, , ,
BN NOOK HD 16GB, http://pdadb.net/index.php?m=specs&id=3895&view=1, 1024, 1300, 900x1440, ARMv7, Yes,
BN NOOK HD 8GB, http://pdadb.net/index.php?m=specs&id=3898&view=1, 1024, 1300, 900x1440, ARMv7, Yes,
BN NOOK HD+ Slate 32GB, http://pdadb.net/index.php?m=specs&id=3899&view=1, 1024, 1500, 1280x1920, ARMv7, Yes,
BN NOOK HD+ Slate 16GB, http://pdadb.net/index.php?m=specs&id=3900&view=1, 1024, 1500, 1280x1920, ARMv7, Yes,
ZTE PF112, http://pdadb.net/index.php?m=specs&id=3400&view=1, 1024,, 720x1024, ARMv7-A,,
ZTE T81, http://pdadb.net/index.php?m=specs&id=3922&view=1, 1024, 1512, 540x960, ARMv7,,
Motorola RAZR M 201M XT902 (Motorola Scorpion Mini), http://pdadb.net/index.php?m=specs&id=3838&view=1, 1024, 1512, 540x960, ARMv7,,
Huawei Honor+ (Huawei C8950D), http://pdadb.net/index.php?m=specs&id=3885&view=1, 768, 1200, 540x960, ARMv7-A, Yes,
Google Nexus 7 32GB (Asus Nakasi), http://pdadb.net/index.php?m=specs&id=3929&view=1, 1024, 1300, 1280x800, ARMv7-A,,
Motorola MT788, http://pdadb.net/index.php?m=specs&id=3934&view=1, 1024, 2000, 540x960, IA-32, Yes,
Sony Xperia V LT25c (Sony Tsubasa), http://pdadb.net/index.php?m=specs&id=3659&view=1, 1024, 1500, 720x1280, ARMv7,,
LG F-200L Optimus Vu II, http://pdadb.net/index.php?m=specs&id=3884&view=1, 2048, 1512, 768x1024, ARMv7,,
Sony Xperia TL LT30a (Sony Mint), http://pdadb.net/index.php?m=specs&id=3917&view=1, 1024, 1512, 720x1280, ARMv7,,
ZTE T98, http://pdadb.net/index.php?m=specs&id=3155&view=1, 1024, 1500, 1280x800, ARMv7-A,,
LG P870 Escape 4G, http://pdadb.net/index.php?m=specs&id=3829&view=1, 1024, 1200, 540x960, ARMv7,,
Huawei Ascend D1 Quad XL (Huawei T9510E), http://pdadb.net/index.php?m=specs&id=3881&view=1, 1024, 1500, 720x1280, ARMv7,,
NTT DoCoMo Sharp Aquos Phone si SH-01E / SH-01E Vivienne Westwood, http://pdadb.net/index.php?m=specs&id=3830&view=1, 1024, 1512, 540x960, ARMv7,,
Samsung GT-S6010 Galaxy Music, http://pdadb.net/index.php?m=specs&id=3930&view=1, 512, 850, 240x320, , ,
Samsung GT-i9305T Galaxy S III 4G, http://pdadb.net/index.php?m=specs&id=3861&view=1, 2048, 1400, 720x1280, ARMv7,,
Sony Xperia AX SO-01E (Sony Tsubasa), http://pdadb.net/index.php?m=specs&id=3879&view=1, 1024, 1512, 720x1280, ARMv7,,
LG P769 Optimus L9, http://pdadb.net/index.php?m=specs&id=3867&view=1, 1024, 1000, 480x854, ARMv7,,
HTC One X+ S728e (HTC Endeavor C2), http://pdadb.net/index.php?m=specs&id=3755&view=1, 1024, 1700, 720x1280, ARMv7-A,,
Samsung GT-i9300 Galaxy S III 64GB, http://pdadb.net/index.php?m=specs&id=3535&view=1, 1024, 1400, 720x1280, ARMv7,,
Sony Xperia T LT30at (Sony Mint Amy), http://pdadb.net/index.php?m=specs&id=3739&view=1, 1024, 1512, 720x1280, ARMv7,,
T-Mobile Samsung SGH-T889 Galaxy Note 2, http://pdadb.net/index.php?m=specs&id=3853&view=1, 2048, 1600, 720x1280, ARMv7,,
Samsung SGH-i317 Galaxy Note II LTE, http://pdadb.net/index.php?m=specs&id=3826&view=1, 2048, 1600, 720x1280, ARMv7,,
ZTE V882 (ZTE Lord), http://pdadb.net/index.php?m=specs&id=3762&view=1, 512, 1400, 480x800, ARMv7, Yes,
Alcatel One Touch T10, http://pdadb.net/index.php?m=specs&id=3924&view=1, 1024, 1000, 800x480, ARMv7-A,,
Huawei Ascend HW-01E (Huawei U9501L), http://pdadb.net/index.php?m=specs&id=3793&view=1, 1024, 1500, 720x1280, ARMv7,,
Huawei Ascend G306T (Huawei T8808D), http://pdadb.net/index.php?m=specs&id=3845&view=1, 512, 1000, 480x800, ARMv7-A,,
Vodafone SmartTab II A2107 4GB, http://pdadb.net/index.php?m=specs&id=3850&view=1, 1024, 1000, 1024x600, ARMv7,,
LG LS970 Eclipse 4G LTE, http://pdadb.net/index.php?m=specs&id=3550&view=1, 2048, 1512, 768x1280, ARMv7,,
Samsung GT-i9305 Galaxy S III LTE EU, http://pdadb.net/index.php?m=specs&id=3789&view=1, 2048, 1400, 720x1280, ARMv7,,
Samsung Galaxy Tab 7.7 Plus SC-01E, http://pdadb.net/index.php?m=specs&id=3799&view=1, 1024, 1500, 1280x800, ARMv7,,
LG Optimus G L-01E, http://pdadb.net/index.php?m=specs&id=3790&view=1, 2048, 1512, 720x1280, ARMv7,,
Samsung GT-i8190 Galaxy S III Mini NFC 16GB, http://pdadb.net/index.php?m=specs&id=3925&view=1, 1024, 1000, 480x800, ARMv7-A,,
Samsung GT-i8190 Galaxy S III Mini 8GB, http://pdadb.net/index.php?m=specs&id=3933&view=1, 1024, 1000, 480x800, ARMv7-A,,
Motorola DROID RAZR HD XT926 (Motorola Vanquish), http://pdadb.net/index.php?m=specs&id=3446&view=1, 1024, 1512, 720x1280, ARMv7,,
Motorola DROID RAZR MAXX HD, http://pdadb.net/index.php?m=specs&id=3827&view=1, 1024, 1512, 720x1280, ARMv7,,
ZTE Grand Era V985, http://pdadb.net/index.php?m=specs&id=3883&view=1, 1024, 1500, 720x1280, ARMv7-A,,
Huawei Ascend D1 Quad XL / Ascend D quad XL (Huawei U9510E), http://pdadb.net/index.php?m=specs&id=3393&view=1, 1024, 1500, 720x1280, ARMv7,,
Huawei Ascend G600 (Huawei U8950D), http://pdadb.net/index.php?m=specs&id=3824&view=1, 768, 1200, 540x960, ARMv7,,
Motorola RAZR M XT905 (Motorola Scorpion Mini), http://pdadb.net/index.php?m=specs&id=3828&view=1, 1024, 1512, 540x960, ARMv7,,
Huawei Honor+ (Huawei T8950), http://pdadb.net/index.php?m=specs&id=3886&view=1, 768, 1000, 540x960, ARMv7,,
HTC One SC, http://pdadb.net/index.php?m=specs&id=3834&view=1, 1024, 1000, 480x800, ARMv7-A, Yes,
HTC One ST, http://pdadb.net/index.php?m=specs&id=3835&view=1, 1024, 1000, 480x800, , ,
Sony Xperia J ST26a (Sony JLo), http://pdadb.net/index.php?m=specs&id=3805&view=1, 512, 1000, 480x854, ARMv7-A, Yes,
Sony Xperia V LT25 / LT25i (Sony Tsubasa), http://pdadb.net/index.php?m=specs&id=3806&view=1, 1024, 1512, 720x1280, ARMv7,,
Samsung GT-i9100 Galaxy S2 Crystal Edition, http://pdadb.net/index.php?m=specs&id=3819&view=1, 1024, 1200, 480x800, ARMv7,,
Samsung EK-KC100S Galaxy Camera, http://pdadb.net/index.php?m=specs&id=3887&view=1, 1024, 1400, 1280x720, ARMv7,,
Samsung SGH-i497 Galaxy Tab 2 10.1, http://pdadb.net/index.php?m=specs&id=3901&view=1, 1024, 1000, 1280x800, ARMv7,,
LG LG730 Venice, http://pdadb.net/index.php?m=specs&id=3874&view=1, 768, 1000, 480x800, ARMv7, Yes,
Huawei Ascend D LTE (Huawei U9501L), http://pdadb.net/index.php?m=specs&id=3398&view=1, 1024, 1500, 720x1280, ARMv7,,
Motorola RAZR HD XT925 (Motorola Vanquish), http://pdadb.net/index.php?m=specs&id=3811&view=1, 1024, 1512, 720x1280, ARMv7,,
HTC One SU, http://pdadb.net/index.php?m=specs&id=3836&view=1, 1024, 1000, 480x800, , ,
Sharp SH631W, http://pdadb.net/index.php?m=specs&id=3882&view=1, 512, 1000, 540x960, ARMv7,,
Motorola MOTOLUXE XT XT788, http://pdadb.net/index.php?m=specs&id=3880&view=1, 512, 1000, 540x960, ARMv7-A, Yes,
ZTE Engage / Nova 4.0 V8000, http://pdadb.net/index.php?m=specs&id=3852&view=1, 1024, 1400, 480x800, ARMv7, Yes,
Motorola RAZR i XT890, http://pdadb.net/index.php?m=specs&id=3868&view=1, 1024, 2000, 540x960, IA-32, Yes,
ZTE Grand Era U985, http://pdadb.net/index.php?m=specs&id=3399&view=1, 1024, 1500, 720x1280, ARMv7-A,,
ZTE PF100, http://pdadb.net/index.php?m=specs&id=3401&view=1, 1024, 1500, 1280x800, ARMv7-A,,
LG P760 Optimus L9, http://pdadb.net/index.php?m=specs&id=3800&view=1, 1024, 1000, 480x854, ARMv7,,
Alcatel One Touch OT-997D, http://pdadb.net/index.php?m=specs&id=3896&view=1, 1024, 1000, 480x800, ARMv7,,
Huawei Ascend G309T Pro (Huawei T8830), http://pdadb.net/index.php?m=specs&id=3846&view=1, 512, 1000, 480x800, ARMv7,,
Samsung SCH-R530M Galaxy S III LTE, http://pdadb.net/index.php?m=specs&id=3878&view=1, 2048, 1512, 720x1280, ARMv7,,
Samsung SGH-T779 Galaxy Tab 2 10.1 4G, http://pdadb.net/index.php?m=specs&id=3893&view=1, 1024, 1000, 1280x800, ARMv7,,
ZTE PF200 EU, http://pdadb.net/index.php?m=specs&id=3369&view=1, 1024, 1200, 540x960, ARMv7,,
ZTE Blade III, http://pdadb.net/index.php?m=specs&id=3769&view=1, 512, 1000, 480x800, ARMv7-A, Yes,
Coolpad 8950 MagView II, http://pdadb.net/index.php?m=specs&id=3782&view=1, 1024, 1500, 480x960, ARMv7,,
ZTE Grand X IN 16GB, http://pdadb.net/index.php?m=specs&id=3818&view=1, 1024, 1600, 540x960, IA-32, Yes,
Huawei MediaPad 10 FHD S10-101u 64GB, http://pdadb.net/index.php?m=specs&id=3396&view=1, 1024, 1200, 1920x1200, ARMv7,,
Huawei Ascend P LTE / P1 4G U9202L, http://pdadb.net/index.php?m=specs&id=3411&view=1, 1024, 1500, 540x960, ARMv7,,
Acer Liquid Gallant Duo AK330, http://pdadb.net/index.php?m=specs&id=3672&view=1, 1024, 1000, 540x960, ARMv7,,
Huawei Ascend G330 (Huawei U8825D), http://pdadb.net/index.php?m=specs&id=3676&view=1, 512, 1000, 480x800, ARMv7-A, Yes,
Huawei MediaPad 7 Lite S7-931u, http://pdadb.net/index.php?m=specs&id=3697&view=1, 1024, 1200, 1024x600, ARMv7-A,,
Huawei MediaPad 10 FHD S10-101u 16GB, http://pdadb.net/index.php?m=specs&id=3741&view=1, 1024, 1200, 1920x1200, ARMv7,,
Lenovo IdeaTab A2107A 16GB, http://pdadb.net/index.php?m=specs&id=3817&view=1, 1024, 1000, 1024x600, ARMv7,,
Lenovo LePhone A660, http://pdadb.net/index.php?m=specs&id=3839&view=1, 512, 1000, 480x800, ARMv7,,
HTC Desire 4G LTE ADR6410L (HTC Fireball), http://pdadb.net/index.php?m=specs&id=3876&view=1, 1024, 1200, 540x960, ARMv7,,
LG P895 Optimus Vu, http://pdadb.net/index.php?m=specs&id=3677&view=1, 1024, 1500, 768x1024, ARMv7-A,,
Nikon COOLPIX S800c, http://pdadb.net/index.php?m=specs&id=3781&view=1, 512,, 854x480, ARMv7-A,,
Sony Xperia J ST26 / ST26i (Sony JLo), http://pdadb.net/index.php?m=specs&id=3770&view=1, 512, 1000, 480x854, ARMv7-A, Yes,
NEC Medias Tab UL N-08D, http://pdadb.net/index.php?m=specs&id=3831&view=1, 1024, 1512, 800x1280, ARMv7,,
Samsung SHV-E250S Galaxy Note II LTE, http://pdadb.net/index.php?m=specs&id=3851&view=1, 2048, 1600, 720x1280, ARMv7,,
Acer CloudMobile S500, http://pdadb.net/index.php?m=specs&id=3407&view=1, 1024, 1500, 720x1280, ARMv7,,
Samsung GT-N7100 Galaxy Note II 32GB, http://pdadb.net/index.php?m=specs&id=3802&view=1, 2048, 1600, 720x1280, ARMv7,,
Motorola Master XT605 (Motorola Jorian), http://pdadb.net/index.php?m=specs&id=3894&view=1, 512, 1200, 480x640, ARMv7, Yes,
Sony Xperia Tipo Dual ST21a2 (Sony Tapioca DS), http://pdadb.net/index.php?m=specs&id=3619&view=1, 512, 800, 320x480, ARMv7-A, Yes,
Sony Xperia Tipo ST21a (Sony Tapioca SS), http://pdadb.net/index.php?m=specs&id=3618&view=1, 512, 800, 320x480, ARMv7-A, Yes,
Samsung GT-N7100 Galaxy Note II 64GB, http://pdadb.net/index.php?m=specs&id=3801&view=1, 2048, 1600, 720x1280, ARMv7,,
Samsung GT-N7100 Galaxy Note II 16GB, http://pdadb.net/index.php?m=specs&id=3803&view=1, 2048, 1600, 720x1280, ARMv7,,
Pantech Vega R3 IM-A850K, http://pdadb.net/index.php?m=specs&id=3674&view=1, 2048, 1512, 720x1280, ARMv7,,
Sony Xperia T LT30p (Sony Mint Rita), http://pdadb.net/index.php?m=specs&id=3707&view=1, 1024, 1500, 720x1280, ARMv7,,
Pantech Vega R3 IM-A850S, http://pdadb.net/index.php?m=specs&id=3892&view=1, 2048, 1512, 720x1280, ARMv7,,
Acer Liquid Gallant Duo E350, http://pdadb.net/index.php?m=specs&id=3773&view=1, 1024, 1000, 540x960, ARMv7,,
Samsung SCH-i699 Galaxy Trend, http://pdadb.net/index.php?m=specs&id=3586&view=1,, 1000, 480x800, , ,
Samsung GT-S7562 Galaxy S Duos, http://pdadb.net/index.php?m=specs&id=3765&view=1,, 1000, 480x800, ARMv7-A, Yes,
Samsung EK-GC100 Galaxy Camera, http://pdadb.net/index.php?m=specs&id=3813&view=1, 1024, 1400, 1280x720, ARMv7,,
Samsung GT-N7005 Galaxy Note LTE, http://pdadb.net/index.php?m=specs&id=3864&view=1, 1024, 1500, 800x1280, ARMv7,,
LG F-180S Optimus G, http://pdadb.net/index.php?m=specs&id=3791&view=1, 2048, 1512, 768x1280, ARMv7,,
Archos Gen10 101 XS, http://pdadb.net/index.php?m=specs&id=3768&view=1, 1024, 1500, 1280x800, ARMv7, Yes,
Samsung SPH-M950 Galaxy Reverb, http://pdadb.net/index.php?m=specs&id=3780&view=1, 768, 1400, 480x800, ARMv7, Yes,
Samsung SCH-i659 Galaxy Ace Plus, http://pdadb.net/index.php?m=specs&id=3849&view=1, 512, 1000, 320x480, ARMv7-A, Yes,
T-Mobile Samsung SGH-T699 Galaxy S Relay 4G / Blaze Q, http://pdadb.net/index.php?m=specs&id=3754&view=1, 1024, 1500, 800x480, ARMv7,,
Fujitsu Stylistic M532, http://pdadb.net/index.php?m=specs&id=3316&view=1, 1024, 1400, 1280x800, ARMv7-A,,
ZTE Warp Sequent, http://pdadb.net/index.php?m=specs&id=3837&view=1, 768, 1400, 540x960, IA-32, Yes,
HTC Desire X (HTC Proto), http://pdadb.net/index.php?m=specs&id=3792&view=1, 768, 1000, 480x800, ARMv7-A, Yes,
Samsung SPH-L300 Galaxy Victory 4G LTE (Samsung Gogh), http://pdadb.net/index.php?m=specs&id=3545&view=1, 1024, 1200, 480x800, ARMv7,,
Pantech Flex P8010 (Pantech Oscar), http://pdadb.net/index.php?m=specs&id=3574&view=1, 1024, 1512, 540x960, ARMv7,,
ZTE Skate Acqua, http://pdadb.net/index.php?m=specs&id=3403&view=1, 512, 1000, 480x800, ARMv7-A, Yes,
Coolpad Quattro 4G 5860E, http://pdadb.net/index.php?m=specs&id=3735&view=1, 512, 1000, 480x800, , ,
Huawei Ascend G302D (Huawei U8812D), http://pdadb.net/index.php?m=specs&id=3661&view=1, 512, 1000, 480x800, ARMv7,,
Samsung SPH-M830 Galaxy Rush, http://pdadb.net/index.php?m=specs&id=3779&view=1, 768, 1000, 320x480, ARMv7-A, Yes,
Samsung YP-GP1 Galaxy Player 5.8 32GB, http://pdadb.net/index.php?m=specs&id=3787&view=1, 1024, 1000, 540x960, ARMv7,,
Amazon Kindle Fire 7 HD 32GB, http://pdadb.net/index.php?m=specs&id=3842&view=1, 1024, 1200, 1280x800, ARMv7,,
HTC J Z321e (HTC Nippon), http://pdadb.net/index.php?m=specs&id=3841&view=1, 1024, 1512, 540x960, ARMv7,,
Motorola DROID RAZR M 4G LTE XT907 (Motorola Scorpion Mini), http://pdadb.net/index.php?m=specs&id=3794&view=1, 1024, 1512, 540x960, ARMv7,,
LG US730 Splendor, http://pdadb.net/index.php?m=specs&id=3825&view=1, 1024, 1000, 480x800, ARMv7, Yes,
Sony Xperia SL LT26ii, http://pdadb.net/index.php?m=specs&id=3680&view=1, 1024, 1700, 720x1280, ARMv7,,
ZTE Grand X N970, http://pdadb.net/index.php?m=specs&id=3633&view=1, 1024, 1500, 540x960, ARMv7,,
LG E405 Optimus L3 Dual, http://pdadb.net/index.php?m=specs&id=3742&view=1, 384, 800, 240x320, ARMv7-A, Yes,
Alcatel One Touch OT-993D, http://pdadb.net/index.php?m=specs&id=3871&view=1, 512, 1000, 480x800, ARMv7-A, Yes,
Asus Transformer Pad Infinity 4G LTE 64 GB TF700KL / TF700TL, http://pdadb.net/index.php?m=specs&id=3387&view=1, 1024, 1512, 1920x1200, ARMv7,,
Acer AT390, http://pdadb.net/index.php?m=specs&id=3673&view=1, 512, 1000, 480x800, ARMv5,,
Samsung GT-S5302 Galaxy Pocket Duos / Galaxy Y Duos Lite, http://pdadb.net/index.php?m=specs&id=3840&view=1,, 833, 240x320, ARMv6, Yes,
Sony Xperia Ion HSPA LT28h (Sony Aoba), http://pdadb.net/index.php?m=specs&id=3601&view=1, 1024, 1512, 720x1280, ARMv7,,
Sony Xperia TX LT29 / Xperia T LT29i (Sony Hayabusa), http://pdadb.net/index.php?m=specs&id=3483&view=1, 1024, 1500, 720x1280, ARMv7,,
Sony Xperia Tablet S 3G 16GB, http://pdadb.net/index.php?m=specs&id=3810&view=1, 1024, 1300, 1280x800, ARMv7-A,,
Sony Xperia Tablet S 3G 32GB, http://pdadb.net/index.php?m=specs&id=3815&view=1, 1024, 1300, 1280x800, ARMv7-A,,
Sony Xperia Tablet S 3G 64GB, http://pdadb.net/index.php?m=specs&id=3820&view=1, 1024, 1300, 1280x800, ARMv7-A,,
Sony Xperia Tablet S WiFi 64GB, http://pdadb.net/index.php?m=specs&id=3821&view=1, 1024, 1300, 1280x800, ARMv7-A,,
Sony Xperia Tablet S WiFi 32GB, http://pdadb.net/index.php?m=specs&id=3822&view=1, 1024, 1300, 1280x800, ARMv7-A,,
Sony Xperia Tablet S WiFi 16GB, http://pdadb.net/index.php?m=specs&id=3823&view=1, 1024, 1300, 1280x800, ARMv7-A,,
LG VS950 Intuition / Optimus Vu, http://pdadb.net/index.php?m=specs&id=3646&view=1, 1024, 1512, 768x1024, ARMv7,,
Samsung SCH-i200 Galaxy Stellar 4G (Samsung Jasper), http://pdadb.net/index.php?m=specs&id=3491&view=1, 1024, 1200, 480x800, ARMv7,,
Samsung SPH-D710 Galaxy S II 4G (Samsung Within), http://pdadb.net/index.php?m=specs&id=3772&view=1, 1024, 1200, 480x800, ARMv7,,
ZTE Nova V6500, http://pdadb.net/index.php?m=specs&id=3847&view=1, 256, 1000, 320x480, ARMv7-A, Yes,
Lenovo IdeaPad A2109 16GB, http://pdadb.net/index.php?m=specs&id=3788&view=1, 1024, 1200, 1280x800, ARMv7-A,,
Sharp SH530U, http://pdadb.net/index.php?m=specs&id=3761&view=1, 512, 1000, 480x800, ARMv7,,
Alcatel One Touch OT-991D, http://pdadb.net/index.php?m=specs&id=3869&view=1, 256, 800, 320x480, ARMv6,,
Alcatel One Touch T20, http://pdadb.net/index.php?m=specs&id=3923&view=1, 1024, 1000, 1024x600, ARMv7-A,,
Huawei Ascend D1 Quad / Ascend D quad (Huawei U9510), http://pdadb.net/index.php?m=specs&id=3392&view=1, 1024, 1400, 720x1280, ARMv7,,
Lenovo IdeaPhone / LePhone K860, http://pdadb.net/index.php?m=specs&id=3647&view=1, 1024, 1400, 720x1280, ARMv7,,
Acer Iconia Tab A110 16GB, http://pdadb.net/index.php?m=specs&id=3873&view=1, 1024, 1200, 1024x600, ARMv7-A,,
ViewSonic ViewPhone 5e, http://pdadb.net/index.php?m=specs&id=3435&view=1,,, 480x800, , ,
Samsung GT-i9300T Galaxy S III, http://pdadb.net/index.php?m=specs&id=3549&view=1, 1024, 1400, 720x1280, ARMv7,,
Sony Xperia Miro ST23a (Sony Mesona), http://pdadb.net/index.php?m=specs&id=3622&view=1, 512, 800, 320x480, ARMv7-A, Yes,
Huawei MediaPad 10 FHD WiFi S10-101w, http://pdadb.net/index.php?m=specs&id=3471&view=1, 2048, 1500, 1920x1200, ARMv7,,
NTT DoCoMo Fujitsu Arrows X F-10D, http://pdadb.net/index.php?m=specs&id=3571&view=1, 1024, 1500, 720x1280, ARMv7-A,,
LG MS770 Motion 4G, http://pdadb.net/index.php?m=specs&id=3702&view=1, 1024, 1200, 540x960, ARMv7,,
ZTE Grand X LTE T82, http://pdadb.net/index.php?m=specs&id=3371&view=1, 1024, 1512, 540x960, ARMv7,,
Samsung GT-N8000 Galaxy Note 10.1 64GB, http://pdadb.net/index.php?m=specs&id=3389&view=1, 2048, 1400, 1280x800, ARMv7,,
Archos Elements 97 Carbon, http://pdadb.net/index.php?m=specs&id=3685&view=1, 1024, 1000, 1024x768, ARMv7-A,,
ZTE Anthem 4G N910, http://pdadb.net/index.php?m=specs&id=3370&view=1, 512, 1200, 480x800, ARMv7,,
Sony Xperia acro S LT26w (Sony Hikari), http://pdadb.net/index.php?m=specs&id=3588&view=1, 1024, 1512, 720x1280, ARMv7,,
Motorola Defy Pro XT560 A, http://pdadb.net/index.php?m=specs&id=3521&view=1, 512, 1000, 480x320, ARMv7-A, Yes,
Panasonic Eluga Power P-07D, http://pdadb.net/index.php?m=specs&id=3582&view=1, 1024, 1500, 720x1280, ARMv7,,
HTC Quattro, http://pdadb.net/index.php?m=specs&id=3223&view=1, 1024,, 1280x768, ARMv7-A,,
Huawei Shine U8836D, http://pdadb.net/index.php?m=specs&id=3740&view=1, 512, 1000, 540x960, ARMv7,,
Samsung GT-N8010 Galaxy Note 10.1 WiFi 32GB, http://pdadb.net/index.php?m=specs&id=3390&view=1, 2048, 1400, 1280x800, ARMv7,,
Samsung SCH-i405U Galaxy Metrix 4G (Samsung Aegis), http://pdadb.net/index.php?m=specs&id=3492&view=1, 512, 1000, 480x800, ARMv7,, Yes
NTT DoCoMo Samsung Galaxy S III LTE SC-06D, http://pdadb.net/index.php?m=specs&id=3564&view=1, 1024, 1512, 720x1280, ARMv7,,
Sony Xperia Tipo Dual ST21i2 (Sony Tapioca DS), http://pdadb.net/index.php?m=specs&id=3620&view=1, 512, 800, 320x480, ARMv7-A, Yes,
Sony Walkman NWZ-F806, http://pdadb.net/index.php?m=specs&id=3688&view=1,,, 480x800, , ,
Casio V-T500-WJ, http://pdadb.net/index.php?m=specs&id=3724&view=1, 1024, 1500, 1280x800, ARMv7,,
Motorola Photon Q 4G LTE XT897 (Motorola Asanti), http://pdadb.net/index.php?m=specs&id=3626&view=1, 1024, 1512, 540x960, ARMv7,,
Kyocera Rise C5155, http://pdadb.net/index.php?m=specs&id=3543&view=1, 512, 1000, 320x480, ARMv7, Yes,
Verizon Samsung SCH-i705 Galaxy Tab 2 7.0 4G LTE, http://pdadb.net/index.php?m=specs&id=3614&view=1, 1024, 1200, 1024x600, ARMv7,,
Samsung GT-N8000 Galaxy Note 10.1 32GB / Galaxy Note 800, http://pdadb.net/index.php?m=specs&id=3747&view=1, 2048, 1400, 1280x800, ARMv7,,
Samsung GT-N8010 Galaxy Note 10.1 WiFi 64GB, http://pdadb.net/index.php?m=specs&id=3748&view=1, 2048, 1400, 1280x800, ARMv7,,
Alcatel One Touch OT-993, http://pdadb.net/index.php?m=specs&id=3870&view=1, 512, 1000, 480x800, ARMv7-A, Yes,
NTT DoCoMo LG L-06D Optimus Vu / JOJO, http://pdadb.net/index.php?m=specs&id=3570&view=1, 1024, 1500, 768x1024, ARMv7,,
Sony Xperia advance ST27a (Sony Lotus), http://pdadb.net/index.php?m=specs&id=3587&view=1, 512, 1000, 320x480, ARMv7, Yes,
Casio V-T500-J, http://pdadb.net/index.php?m=specs&id=3725&view=1, 1024, 1500, 1280x800, ARMv7,,
Motorola Atrix HD LTE MB886 (Motorola Dinara), http://pdadb.net/index.php?m=specs&id=3671&view=1, 1024, 1512, 720x1280, ARMv7,,
Panasonic ELUGA Live P-08D, http://pdadb.net/index.php?m=specs&id=3563&view=1, 1024, 1200, 1280x800, ARMv7,,
Huawei Ascend P1 TD (Huawei T9200), http://pdadb.net/index.php?m=specs&id=3627&view=1, 1024, 1536, 540x960, ARMv7,,
Lenovo LePhone S899t, http://pdadb.net/index.php?m=specs&id=3675&view=1, 1024, 1000, 540x960, ARMv7, Yes,
Huawei Ascend Y200T (Huawei T8620), http://pdadb.net/index.php?m=specs&id=3683&view=1, 512, 1000, 320x480, ARMv7,,
LG VS930 Spectrum 2 / Optimus LTE 2, http://pdadb.net/index.php?m=specs&id=3472&view=1, 1024, 1512, 720x1280, ARMv7,,
HTC One S NA (HTC Ville), http://pdadb.net/index.php?m=specs&id=3591&view=1, 1024, 1500, 540x960, ARMv7,,
NTT DoCoMo Sharp Aquos Phone sv SH-10D, http://pdadb.net/index.php?m=specs&id=3606&view=1, 1024, 1512, 720x1280, ARMv7,,
Sony Xperia GX SO-04D (Sony Hayabusa), http://pdadb.net/index.php?m=specs&id=3583&view=1, 1024, 1512, 720x1280, ARMv7,,
Acer Liquid Glow E330, http://pdadb.net/index.php?m=specs&id=3413&view=1, 512, 1000, 480x800, ARMv7-A, Yes,
T-Mobile myTouch Q U8730 (Huawei Buddy), http://pdadb.net/index.php?m=specs&id=3678&view=1, 1024, 1400, 480x800, ARMv7, Yes,
T-Mobile myTouch U8680 (Huawei Phoenix), http://pdadb.net/index.php?m=specs&id=3679&view=1, 1024, 1400, 480x800, ARMv7, Yes,
T-Mobile Samsung SGH-T879 Galaxy Note, http://pdadb.net/index.php?m=specs&id=3522&view=1, 1024, 1500, 800x1280, ARMv7,,
Acer Iconia Tab A110 8GB, http://pdadb.net/index.php?m=specs&id=3616&view=1, 1024, 1200, 1024x600, ARMv7-A,,
ViewSonic ViewPhone 4s, http://pdadb.net/index.php?m=specs&id=3434&view=1, 512, 1000, 540x960, ARMv7-A,,
Huawei Ascend Q M660, http://pdadb.net/index.php?m=specs&id=3481&view=1,, 800, 320x480, , ,
Motorola RAZR V XT885 (Motorola Yangtze), http://pdadb.net/index.php?m=specs&id=3682&view=1, 1024, 1200, 540x960, ARMv7,,
Samsung SCH-R940 Galaxy S Lightray 4G (Samsung Stealth), http://pdadb.net/index.php?m=specs&id=3441&view=1, 512, 1000, 480x800, ARMv7,, Yes
Motorola ELECTRIFY 2 XT881 (Motorola Yangtze), http://pdadb.net/index.php?m=specs&id=3751&view=1, 1024, 1200, 540x960, ARMv7,,
Motorola Defy XT XT556 / XT557, http://pdadb.net/index.php?m=specs&id=3753&view=1, 512, 1000, 480x854, ARMv7-A, Yes,
Pantech Marauder ADR910L (Pantech Star Q), http://pdadb.net/index.php?m=specs&id=3723&view=1, 1024, 1200, 480x800, ARMv7,,
ZTE Light Tab V9S, http://pdadb.net/index.php?m=specs&id=3417&view=1, 1024, 1200, 1280x800, ARMv7,,
Huawei Ascend G312 QWERTY U8730 (Huawei Buddy), http://pdadb.net/index.php?m=specs&id=3558&view=1, 1024, 1400, 480x800, ARMv7, Yes,
T-Mobile Ascend G312 U8680 (Huawei Phoenix), http://pdadb.net/index.php?m=specs&id=3461&view=1, 1024, 1400, 480x800, ARMv7, Yes,
NTT DoCoMo Arrows Me F-11D (Quanta Swordfish), http://pdadb.net/index.php?m=specs&id=3559&view=1,, 1000, 480x800, ARMv7, Yes,
NTT DoCoMo Fujitsu F-09D Anteprima, http://pdadb.net/index.php?m=specs&id=3585&view=1, 1024, 1400, 480x800, ARMv7, Yes,
Sony Xperia go ST27 / ST27i (Sony Lotus), http://pdadb.net/index.php?m=specs&id=3556&view=1, 512, 1000, 320x480, ARMv7, Yes,
Samsung SHW-M480K Galaxy Note 10.1, http://pdadb.net/index.php?m=specs&id=3763&view=1, 2048, 1400, 1280x800, ARMv7,,
Samsung SHW-M480S Galaxy Note 10.1, http://pdadb.net/index.php?m=specs&id=3764&view=1, 2048, 1400, 1280x800, ARMv7,,
